Product ID,Name,Price,Quantity,Category,Description,Production Date,Expiration Date,Rating,Status
106,Пакеты для детских вещей,7198,859,Товары для дома,"Отличается высоким содержанием таурина, необходимого для здоровья глаз и сердца.",2012-02-15,2025-03-10,3.86,Awaiting Review
107,Тыква,4817,759,Овощи,Подходит для людей с чувствительным пищеварением.,2016-02-27,2026-02-13,1.22,Awaiting Payment
108,Сок томатный,310,670,Напитки,Является важным компонентом рациона для поддержания гормонального баланса.,2007-05-13,2017-07-14,2.47,Shipping
109,Пармезан,727,731,Молочные продукты,Помогает поддерживать нормальный уровень pH в организме.,2010-09-01,2014-02-13,1.6,Refunded
110,Славяновская,1327,123,Напитки,Помогает укреплять стенки сосудов и улучшать кровообращение.,2013-06-07,2021-01-05,0.77,Available for Pickup
111,Черешня,9696,945,Фрукты,Высокое содержание белка обеспечивает длительное чувство сытости и способствует поддержанию мышечной массы.,1993-06-01,2029-07-26,1.1,Backorder
112,Куриные крылышки,796,467,Мясо,Помогает поддерживать нормальный уровень артериального давления.,1990-11-06,1992-05-01,2.02,Shipping
113,Мороженое,1221,163,Молочные продукты,"Отличается высоким содержанием нарингина, флавоноида, полезного для снижения уровня холестерина и улучшения пищеварения.",2019-03-04,2023-02-11,1.24,Refunded
114,Прошутто,7541,428,Мясо,"Отличается высоким содержанием меди, необходимой для синтеза коллагена и эластина.",2009-04-02,2025-01-02,2.22,Awaiting Payment
115,Говядина,6776,478,Мясо,"Является источником важных микроэлементов, таких как магний и калий.",2000-02-10,2025-01-13,3.73,Awaiting Payment
116,Глинтвейн,8747,479,Напитки,"Помогает поддерживать нормальный уровень дофамина, гормона, отвечающего за мотивацию и удовольствие.",2018-05-24,2020-02-11,3.98,New
117,Шпик,8663,906,Мясо,Подходит для людей с чувствительным пищеварением.,1993-03-13,2007-09-10,3.43,Shipping
118,Авокадо,3072,251,Фрукты,"Отличается высоким содержанием витаминов группы D, необходимых для здоровья костей и иммунитета.",2015-01-05,2029-02-01,1.05,Awaiting Review
119,Ямс,5039,192,Овощи,Отличается низкой вероятностью возникновения побочных эффектов при употреблении.,2012-03-01,2014-08-08,0.17,On Backorder
120,Катык,7824,871,Молочные продукты,"Легко усваивается организмом, обеспечивая быстрое насыщение и энергию.",2014-01-23,2021-01-09,0.26,Awaiting Review
121,Картофель,9832,988,Овощи,Отличается низкой вероятностью возникновения побочных эффектов при употреблении.,2012-05-19,2016-02-05,0.41,Temporarily Unavailable
122,Морковь,577,574,Овощи,Рекомендуется для ежедневного потребления в умеренных количествах.,2001-06-05,2008-01-01,2.29,New
123,Помело,5266,376,Фрукты,"Помогает поддерживать нормальный уровень даидзеина, изофлавона, полезного для здоровья женщин во время менопаузы.",2002-05-19,2015-07-06,3.35,Returned
124,Пармезан,1545,204,Молочные продукты,"Отличается высоким содержанием тиамина, необходимого для нормального функционирования нервной системы.",2003-04-04,2026-01-13,0.95,On Backorder
125,Миксер,1452,803,Товары для дома,"Помогает поддерживать нормальный уровень апигенина, флавоноида, полезного для здоровья мозга и иммунной системы.",2013-06-04,2015-07-12,4.82,Refunded
126,Темный шоколад,9792,82,Бакалея,Прошел тщательный отбор сырья и контроль на каждом этапе производства.,2020-03-08,2027-06-03,1.87,Delivered
127,Ложки чайные,8914,609,Товары для дома,"Отличается высоким содержанием ниацина, необходимого для здоровья кожи и пищеварения.",2009-01-05,2016-05-11,3.65,Delivered
128,Каша из полбы,8489,597,Бакалея,"Отличается высоким содержанием антиоксидантов, защищающих клетки от окислительного стресса.",2002-01-02,2016-02-14,3.21,Awaiting Payment
129,Амарант крупа,9180,486,Бакалея,Отличается высокой эффективностью в борьбе с анемией благодаря содержанию железа.,2002-05-13,2005-01-26,2.95,Temporarily Unavailable
130,Брюква,8625,4,Овощи,"Отличается высоким содержанием эллаговой кислоты, вещества, обладающего противораковыми свойствами.",1997-02-04,2027-03-04,0.32,Sold
131,Просо,4344,847,Бакалея,"Является источником антиоксидантов, замедляющих процессы старения.",1996-05-10,2019-01-03,3.55,Shipping
132,Парфюм,3068,229,Товары для дома,Отличается высокой питательностью и способен быстро утолить голод.,2022-12-09,2029-06-05,0.24,Shipping
133,Каша из дробленой перловки,9490,531,Бакалея,"Является источником важных микроэлементов, таких как магний и калий.",2013-01-16,2014-02-09,4.68,Shipping
134,Клюква,4714,486,Фрукты,"Является источником важных микроэлементов, таких как магний и калий.",2014-01-08,2019-01-14,0.73,Cancelled
135,Ананас,1930,260,Фрукты,"Помогает поддерживать нормальный уровень апигенина, флавоноида, полезного для здоровья мозга и иммунной системы.",2013-01-09,2014-07-01,3.86,Backorder
136,Цветная капуста,8450,320,Овощи,"Отличается высоким содержанием хлорогеновых кислот, веществ, способствующих снижению веса и контролю уровня сахара в крови.",2022-01-05,2025-02-27,2.7,Refunded
137,"Экзотические виды мяса (например, страус, кенгуру)",8553,215,Мясо,Отличается удобством использования и экономичностью в расходе.,2018-05-03,2019-03-02,2.6,Returned
138,Котлеты,4372,131,Мясо,Поддерживает иммунитет и общее состояние здоровья.,1991-06-16,1996-01-02,1.33,Available for Pickup
139,Ливерная колбаса,1393,848,Мясо,"Отличается высоким содержанием генистеина, изофлавона, полезного для здоровья костей и профилактики рака.",1999-03-11,2026-01-03,4.88,Returned
140,Полотенца кухонные,5340,540,Товары для дома,"Помогает поддерживать нормальный уровень апигенина, флавоноида, полезного для здоровья мозга и иммунной системы.",2008-08-02,2021-01-14,1.96,Delivered
141,Творог,891,779,Бакалея,"Может использоваться как основа для приготовления домашних йогуртов, сыров и других молочных продуктов.",1998-01-19,2027-05-15,3.04,Pending
142,Чечевица,6847,376,Овощи,Помогает поддерживать здоровье нервной системы благодаря содержанию магния.,2012-02-10,2018-01-11,1.89,Shipping
143,Грейпфрут,3917,985,Фрукты,Придает блюдам особую нежность и насыщенность.,2015-04-15,2020-01-12,2.01,On Backorder
144,Сок апельсиновый,5749,404,Напитки,"Отличается высоким содержанием пантотеновой кислоты, необходимой для метаболизма жиров, белков и углеводов.",2003-01-03,2018-04-11,4.05,Returned
145,Айран,3091,659,Молочные продукты,"Популярен среди спортсменов и людей, ведущих активный образ жизни.",2000-02-02,2027-04-16,1.59,Pending
146,Топлёное молоко,4715,257,Молочные продукты,"Популярен среди спортсменов и людей, ведущих активный образ жизни.",1993-01-19,2012-07-02,4.92,Available for Pickup
147,Пакеты для походов,8669,342,Товары для дома,Помогает предотвратить развитие остеопороза благодаря высокому содержанию кальция.,2017-03-14,2019-01-15,2.01,In Stock
148,Слива,3266,274,Фрукты,"Помогает поддерживать нормальный уровень 5-гидрокситриптофана (5-HTP), предшественника серотонина.",2016-02-01,2023-03-24,0.8,Backorder
149,Сулинка,3244,662,Напитки,"Является источником витаминов группы B, необходимых для энергетического обмена.",2022-02-28,2027-01-03,4.72,Shipping
150,Зельц,3046,675,Мясо,"Подходит для веганов и вегетарианцев, если произведен без использования животных компонентов.",1999-05-03,2023-02-02,4.16,Backorder
151,Сырокопченая колбаса,118,860,Мясо,Отвечает всем современным стандартам качества и безопасности.,2000-03-14,2018-03-02,0.66,Available for Pickup
152,Пакеты для благотворительного мероприятия,3230,112,Товары для дома,"Имеет низкий гликемический индекс, что делает его безопасным для диабетиков.",2005-02-27,2024-02-04,0.38,Awaiting Payment
153,Шадринская,2375,193,Напитки,"Отличается высоким содержанием витамина E, необходимого для защиты клеточных мембран.",1991-05-04,2011-02-02,4.43,On Backorder
154,Айран,4579,429,Молочные продукты,Широко используется в традиционной и современной кухне.,2016-06-05,2028-01-10,3.87,Sold
155,"Сухофрукты (изюм, курага, чернослив)",3171,629,Бакалея,"Отличается высоким содержанием рутина, флавоноида, укрепляющего сосуды и улучшающего кровообращение.",2005-01-27,2011-01-05,2.39,In Stock
156,Портулак,3997,630,Овощи,Помогает поддерживать оптимальный вес и форму тела.,2012-03-08,2017-02-22,3.58,Cancelled
157,Утка,9395,719,Мясо,"Помогает поддерживать нормальный уровень кортизола, гормона стресса.",2018-09-16,2020-01-15,2.2,Returned
158,Крыжовник,8198,370,Фрукты,"Помогает поддерживать нормальный уровень ацетилхолина, нейромедиатора, ответственного за память и обучение.",2011-07-08,2011-11-05,0.4,Delivered
159,Камамбер,1816,893,Молочные продукты,Отвечает всем современным стандартам качества и безопасности.,2015-03-04,2017-04-11,0.08,Returned
160,Инжир,761,303,Фрукты,Прошел строгий контроль качества на всех этапах производства.,2002-04-18,2011-02-14,4.35,On Backorder
161,Смузи бананово-клубничный,1853,98,Напитки,"Производится из высококачественного сырья, что гарантирует его безопасность и пользу для здоровья.",2020-03-09,2023-02-27,3.14,Temporarily Unavailable
162,Дыня,3632,736,Фрукты,"Помогает поддерживать нормальный уровень апигенина, флавоноида, полезного для здоровья мозга и иммунной системы.",2005-01-01,2020-05-11,0.59,Delivered
163,Пакеты для походов,1483,458,Товары для дома,"Может использоваться как основа для приготовления домашних йогуртов, сыров и других молочных продуктов.",2015-03-13,2015-04-02,1.97,Temporarily Unavailable
164,Кефир,9000,52,Молочные продукты,"Отличается устойчивостью к температурным изменениям, что облегчает хранение.",2010-01-03,2010-04-10,4.74,Pending
165,Томатная паста,5991,464,Бакалея,Помогает поддерживать нормальный уровень глюкозы в крови.,1994-06-08,2006-01-22,0.98,Delivered
166,Лавровый лист сушеный,7757,802,Бакалея,"Помогает поддерживать нормальный уровень мирицетина, флавоноида, обладающего антиоксидантными и противовоспалительными свойствами.",1996-02-12,2003-02-10,4.53,Delivered
167,Павловская,6134,625,Напитки,Подходит для использования в диетических программах для похудения.,1999-04-01,2019-02-18,1.66,Cancelled
168,Шницель,4029,91,Мясо,Отличается удобством использования и экономичностью в расходе.,2003-11-17,2028-02-01,0.1,Available for Pickup
169,Курт,996,669,Молочные продукты,Прошел независимые лабораторные исследования и получил положительные отзывы экспертов.,2005-06-13,2013-08-05,2.76,Backorder
170,Боржоми,5314,224,Напитки,"Отличается высоким содержанием бета-каротина, необходимого для здоровья глаз и кожи.",2010-03-08,2029-01-01,4.54,Awaiting Payment
171,Сливки,474,188,Молочные продукты,"Является источником важных микроэлементов, таких как магний и калий.",2010-01-01,2024-03-21,4.99,In Stock
172,Голландский сыр,9301,589,Молочные продукты,"Помогает поддерживать нормальный уровень дигидротестостерона, гормона, отвечающего за половое созревание у мужчин.",2021-08-03,2025-01-20,4.48,Refunded
